{
  "$schema": "../presets.schema.json",
  "pack": {
    "name": "documentary-cinema",
    "version": "1.0.0",
    "author": "Motion direction pack",
    "intent": "A restrained, cinema-grade motion language for information-dense explainers (history, polity, geography, economics, science; English + Hindi). Five coordinated families share one timing philosophy: documentary (deliberate reveals, long settles), editorial (sharp, precise), data (mechanical, counter-driven), archival (paper and ink) and a cine camera kit (dolly, track, boom, orbit, focus pull, lock-off) built on move → settle → read → next move.",
    "requires": []
  },

  "easings": {
    "docSettle":  { "intent": "Long, soft deceleration with no overshoot; the house settle for text and camera holds.", "curve": [0.16, 1, 0.3, 1] },
    "docLand":    { "intent": "Near-critically damped spring: one small controlled overshoot, then rest. Cards and dimensional turns.", "curve": { "type": "spring", "stiffness": 260, "damping": 24, "mass": 1 } },
    "docPunch":   { "intent": "Quick attack with a restrained overshoot for figures and impact moments.", "curve": [0.3, 1.35, 0.5, 1] },
    "docPrecise": { "intent": "Symmetric in-out with no overshoot; mechanical and exact, for data and reframes.", "curve": [0.65, 0, 0.35, 1] },
    "docExit":    { "intent": "Accelerating ease-in so exits clear the frame faster than entries arrive.", "curve": [0.6, 0, 0.9, 0.4] },
    "cineCamera": { "intent": "Committed start, very long settle: the house camera curve for dollies, tracks and cranes.", "curve": [0.45, 0, 0.12, 1] },
    "cineWhip":   { "intent": "Aggressive speed ramp for whip pans: almost all travel happens mid-move.", "curve": [0.9, 0, 0.1, 1] }
  },

  "entry": {
    "docRiseSettle": {
      "intent": "Words rise from just below the baseline in reading order, dip a hair past their line and settle out of a light blur; the workhorse entry for explanations, causes and steps.",
      "duration": 0.7, "ease": "docSettle", "anchor": "baseline",
      "stagger": { "unit": "word", "each": 0.05, "from": "start", "maxTotal": 0.4 },
      "props": {
        "y": [[0, 56], [0.7, -3], [1, 0]],
        "opacity": [[0, 0], [0.35, 1]],
        "blur": [[0, 6], [0.6, 0]]
      }
    },
    "docAnticipateRise": {
      "intent": "Words first sink a few pixels (anticipation), then accelerate up into place and settle; a physical, intentional entry for directional progress and results.",
      "duration": 0.75, "ease": "docSettle", "anchor": "baseline",
      "stagger": { "unit": "word", "each": 0.05, "from": "start", "maxTotal": 0.35 },
      "props": {
        "y": [[0, 38], [0.22, 50, "docPrecise"], [0.75, -4], [1, 0]],
        "opacity": [[0, 0], [0.3, 1]],
        "blur": [[0, 4], [0.55, 0]]
      }
    },
    "docDepthReveal": {
      "intent": "The phrase travels forward out of depth, sharpening from blur while a faint shade lifts off it; cinematic reveal for examples and final conclusions.",
      "duration": 0.9, "ease": "docSettle", "anchor": "center",
      "stagger": { "unit": "word", "each": 0.05, "from": "center", "maxTotal": 0.35 },
      "props": {
        "z": [[0, 420], [1, 0]],
        "opacity": [[0, 0], [0.38, 1]],
        "blur": [[0, 10], [0.72, 0]],
        "shade": [[0, 0.35], [0.8, 0]]
      }
    },
    "docTrackingReveal": {
      "intent": "Letters condense inward from wide tracking, centre-out, while the word sharpens and scale settles; an elegant hero-title reveal (Devanagari falls back to per-word automatically).",
      "duration": 0.85, "ease": "docSettle", "anchor": "center",
      "stagger": { "unit": "char", "each": 0.025, "from": "center", "maxTotal": 0.35 },
      "props": {
        "tracking": [[0, 0.35], [1, 0]],
        "scale": [[0, 1.04], [1, 1]],
        "opacity": [[0, 0], [0.3, 1]],
        "blur": [[0, 5], [0.65, 0]]
      }
    },
    "docEdgesConverge": {
      "intent": "Letters resolve from the outer edges of the word toward its centre, focusing as they arrive; a reveal for a single key term that 'comes together'.",
      "duration": 0.8, "ease": "docSettle", "anchor": "center",
      "stagger": { "unit": "char", "each": 0.03, "from": "edges", "maxTotal": 0.3 },
      "props": {
        "scale": [[0, 0.82], [1, 1]],
        "opacity": [[0, 0], [0.35, 1]],
        "blur": [[0, 8], [0.7, 0]]
      }
    },
    "docPerspectiveTurn": {
      "intent": "Each word swings in on a left-hinged Y-axis turn like a page coming flat, shading off as it faces the viewer; for the sides of a comparison and dimensional card moments.",
      "duration": 0.8, "ease": "docLand", "anchor": "left",
      "stagger": { "unit": "word", "each": 0.05, "from": "start", "maxTotal": 0.35 },
      "props": {
        "rotY": [[0, -55], [1, 0]],
        "x": [[0, -40], [1, 0]],
        "shade": [[0, 0.5], [0.85, 0]],
        "opacity": [[0, 0], [0.35, 1]]
      }
    },
    "editorialSnap": {
      "intent": "Words slide in from the right with a slight speed lean, snap a few pixels past their mark and straighten; a sharp editorial entry for warnings and corrections.",
      "duration": 0.45, "ease": "docSettle", "anchor": "left",
      "stagger": { "unit": "word", "each": 0.04, "from": "start", "maxTotal": 0.3 },
      "props": {
        "x": [[0, 90], [0.6, -6], [1, 0]],
        "skewX": [[0, -8], [0.6, 1], [1, 0]],
        "opacity": [[0, 0], [0.25, 1]],
        "blur": [[0, 8], [0.5, 0]]
      }
    },
    "docInkReveal": {
      "intent": "Glyphs wipe on left to right as if written in ink, bleeding from a soft blur into crisp type; archival reveal for definitions and quotations.",
      "duration": 0.9, "ease": "docSettle", "anchor": "left",
      "stagger": { "unit": "char", "each": 0.03, "from": "start", "maxTotal": 0.4 },
      "props": {
        "reveal": [[0, 0], [0.85, 1]],
        "opacity": [[0, 0], [0.3, 1]],
        "blur": [[0, 5], [0.7, 0]]
      }
    },
    "dataLockIn": {
      "intent": "Digits grow up from the baseline, lock a touch tall and settle square, character by character; precise entry for statistics, dates and figures.",
      "duration": 0.55, "ease": "docPrecise", "anchor": "baseline",
      "stagger": { "unit": "char", "each": 0.03, "from": "start", "maxTotal": 0.3 },
      "props": {
        "scaleY": [[0, 0.4], [0.65, 1.04], [1, 1]],
        "y": [[0, 18], [0.65, 0]],
        "opacity": [[0, 0], [0.3, 1]],
        "blur": [[0, 4], [0.55, 0]]
      }
    },
    "docDropCatch": {
      "intent": "Words drop in from above like set cards, land with a small catch and let their lifted shadow settle; for historical events landing on a timeline.",
      "duration": 0.65, "ease": "docLand", "anchor": "bottom",
      "stagger": { "unit": "word", "each": 0.05, "from": "start", "maxTotal": 0.35 },
      "props": {
        "y": [[0, -70], [0.6, 4], [1, 0]],
        "lift": [[0, 12], [1, 0]],
        "scale": [[0, 1.06], [1, 1]],
        "opacity": [[0, 0], [0.3, 1]]
      }
    },
    "archivalPaperLift": {
      "intent": "Words tip up from lying flat on the desk like a paper slip raised into view, the lift shadow and shading easing away; archival entry for records and primary sources.",
      "duration": 0.75, "ease": "docSettle", "anchor": "bottom",
      "stagger": { "unit": "word", "each": 0.05, "from": "start", "maxTotal": 0.35 },
      "props": {
        "rotX": [[0, 35], [1, 0]],
        "y": [[0, 30], [1, 0]],
        "lift": [[0, 18], [1, 0]],
        "shade": [[0, 0.4], [0.8, 0]],
        "opacity": [[0, 0], [0.35, 1]]
      }
    },
    "docSoftFocus": {
      "intent": "A quiet word-by-word fade up with a short rise and gentle focus pull; the low-distraction entry for dense explanations, questions and evidence.",
      "duration": 0.5, "ease": "docSettle", "anchor": "baseline",
      "stagger": { "unit": "word", "each": 0.04, "from": "start", "maxTotal": 0.3 },
      "props": {
        "y": [[0, 12], [1, 0]],
        "opacity": [[0, 0], [0.4, 1]],
        "blur": [[0, 3], [0.7, 0]]
      }
    }
  },

  "emphasis": {
    "docScalePunch": {
      "intent": "The word swells about 12% with a slight lift, dips a hair under size and returns; a controlled punch reserved for genuinely important terms, figures and warnings.",
      "duration": 0.6, "ease": "docSettle", "anchor": "baseline",
      "stagger": { "unit": "word", "each": 0.03, "from": "center", "maxTotal": 0.2 },
      "props": {
        "scale": [[0, 1], [0.3, 1.12], [0.65, 0.98], [1, 1]],
        "lift": [[0, 0], [0.3, 6], [1, 0]]
      }
    },
    "docTrackingBreathe": {
      "intent": "Letter spacing opens slightly and closes again, drawing the eye without moving the word; quiet emphasis for key terms and definitions.",
      "duration": 0.8, "ease": "docSettle", "anchor": "center",
      "props": { "tracking": [[0, 0], [0.45, 0.08], [1, 0]] }
    },
    "docDepthPush": {
      "intent": "The phrase eases toward the camera and back with a faint lift, like a card nudged forward; emphasis for the effect side of a stated cause-effect pair.",
      "duration": 0.7, "ease": "docSettle", "anchor": "center",
      "props": {
        "z": [[0, 0], [0.4, -60], [1, 0]],
        "lift": [[0, 0], [0.4, 4], [1, 0]]
      }
    },
    "docNudgeForward": {
      "intent": "The phrase leans a few pixels forward in the reading direction and returns, signalling 'this leads on'; for steps and sequence items.",
      "duration": 0.55, "ease": "docSettle", "anchor": "left",
      "props": {
        "x": [[0, 0], [0.35, 14], [1, 0]],
        "skewX": [[0, 0], [0.35, -3], [1, 0]]
      }
    },
    "docFocusPulse": {
      "intent": "A single brief dip in opacity and focus that snaps back crisp, a double-take for corrections; never repeats.",
      "duration": 0.6, "ease": "docSettle", "anchor": "center",
      "props": {
        "opacity": [[0, 1], [0.25, 0.7], [0.6, 1], [1, 1]],
        "blur": [[0, 0], [0.25, 1.5], [0.6, 0], [1, 0]]
      }
    },
    "dataTick": {